<?xml version="1.0" encoding="utf-8"?>
<xs:schema attributeFormDefault="unqualified" elementFormDefault="qualified" xmlns:xs="http://www.w3.org/2001/XMLSchema">
  <xs:element name="orders">
    <xs:complexType>
      <xs:sequence>
        <xs:element name="order">
          <xs:complexType>
            <xs:sequence>
              <xs:element name="supplier">
                <xs:complexType>
                  <xs:sequence>
                    <xs:element name="companyName" type="xs:string" />
                  </xs:sequence>
                </xs:complexType>
              </xs:element>
              <xs:element name="date" type="xs:string" />
              <xs:element name="status" type="xs:string" />
              <xs:element name="payment">
                <xs:complexType>
                  <xs:sequence>
                    <xs:element name="type" type="xs:string" />
                  </xs:sequence>
                </xs:complexType>
              </xs:element>
              <xs:element name="item">
                <xs:complexType>
                  <xs:sequence>
                    <xs:element name="name" type="xs:string" />
                    <xs:element name="quantity" type="xs:unsignedByte" />
                    <xs:element name="amount" type="xs:unsignedShort" />
                  </xs:sequence>
                </xs:complexType>
              </xs:element>
            </xs:sequence>
            <xs:attribute name="id" type="xs:unsignedByte" use="required" />
          </xs:complexType>
        </xs:element>
      </xs:sequence>
    </xs:complexType>
  </xs:element>
</xs:schema>