<?xml version="1.0" encoding="utf-8"?>
<orders xmlns:xsi="http://www.w3.org/2001/XMLSchema-instance"
    xsi:noNamespaceSchemaLocation="purchaseOrder.xsd">
    <order id="001">
        <supplier>
            <companyName>Nike</companyName>
        </supplier>
        <date>26-07-2008</date>
        <status>complete</status>
        <!-- complete, cancelled, pending -->
        <payment>
            <type>cheque</type>
        </payment>
        <item>
            <name>shoe</name>
            <quantity>100</quantity>
            <amount>50000</amount>
        </item>
    </order>
</orders>